<CSE532 xmlns="http://localhost:8080/exist/CSE532" xmlns:xsi="http://www.w3.org/2001/XMLSchema-instance" xsi:schemaLocation="http://localhost:8080/exist/CSE532 CSE532.xsd">
    <!-- Contestant -->
    <Contestants>
        <Contestant>
            <CId>c1</CId>
            <Name>Joe</Name>
        </Contestant>

        <Contestant>
            <CId>c2</CId>
            <Name>Bob</Name>
        </Contestant>

        <Contestant>
            <CId>c3</CId>
            <Name>Mary</Name>
        </Contestant>

        <Contestant>
            <CId>c4</CId>
            <Name>Bess</Name>
        </Contestant>

        <Contestant>
            <CId>c5</CId>
            <Name>Tom</Name>
        </Contestant>

        <Contestant>
            <CId>c6</CId>
            <Name>Don</Name>
        </Contestant>

        <Contestant>
            <CId>c7</CId>
            <Name>Ann</Name>
        </Contestant>
    </Contestants>
    
    <!-- Show -->
    <Shows>
        <Show>
            <SId>s1</SId>
            <Date>2014-02-02</Date>
        </Show>
        <Show>
            <SId>s2</SId>
            <Date>2014-04-02</Date>
        </Show>
        <Show>
            <SId>s3</SId>
            <Date>2014-06-05</Date>
        </Show>
        <Show>
            <SId>s4</SId>
            <Date>2014-08-02</Date>
        </Show>
        <Show>
            <SId>s5</SId>
            <Date>2014-06-05</Date>
        </Show>
    </Shows>

    
    <!-- Artwork -->
    <Artworks>
        <Artwork>
            <AId>a1</AId>
            <Name>Barcarolle</Name>
        </Artwork>
        <Artwork>
            <AId>a2</AId>
            <Name>Giselle</Name>
        </Artwork>
        <Artwork>
            <AId>a3</AId>
            <Name>Bumblebee</Name>
        </Artwork>
        <Artwork>
            <AId>a4</AId>
            <Name>Besame Mucho</Name>
        </Artwork>
        <Artwork>
            <AId>a5</AId>
            <Name>Swan Lake</Name>
        </Artwork>
        <Artwork>
            <AId>a6</AId>
            <Name>Habanera</Name>
        </Artwork>
    </Artworks>
    <!-- Judge -->
    <Judges>
        <Judge>
            <JId>j1</JId>
            <Name>Judy</Name>
        </Judge>
        <Judge>
            <JId>j2</JId>
            <Name>Lucy</Name>
        </Judge>
        <Judge>
            <JId>j3</JId>
            <Name>Irving</Name>
        </Judge>
        <Judge>
            <JId>j4</JId>
            <Name>Phil</Name>
        </Judge>
        <Judge>
            <JId>j5</JId>
            <Name>Oscar</Name>
        </Judge>
    </Judges>
    <!-- Audition -->
    <Auditions>
        <Audition>
            <Score>7</Score>
            <CId>c1</CId>
            <AId>a1</AId>
            <SId>s1</SId>
            <JId>j1</JId>
        </Audition>
        <Audition>
            <Score>8</Score>
            <CId>c1</CId>
            <AId>a1</AId>
            <SId>s1</SId>
            <JId>j2</JId>
        </Audition>
        <Audition>
            <Score>6</Score>
            <CId>c1</CId>
            <AId>a1</AId>
            <SId>s1</SId>
            <JId>j3</JId>
        </Audition>

        <Audition>
            <Score>5</Score>
            <CId>c3</CId>
            <AId>a1</AId>
            <SId>s1</SId>
            <JId>j1</JId>
        </Audition>
        <Audition>
            <Score>6</Score>
            <CId>c3</CId>
            <AId>a1</AId>
            <SId>s1</SId>
            <JId>j2</JId>
        </Audition>
        <Audition>
            <Score>6</Score>
            <CId>c3</CId>
            <AId>a1</AId>
            <SId>s1</SId>
            <JId>j3</JId>
        </Audition>

        <Audition>
            <Score>9</Score>
            <CId>c3</CId>
            <AId>a2</AId>
            <SId>s1</SId>
            <JId>j1</JId>
        </Audition>
        <Audition>
            <Score>6</Score>
            <CId>c3</CId>
            <AId>a2</AId>
            <SId>s1</SId>
            <JId>j2</JId>
        </Audition>
        <Audition>
            <Score>8</Score>
            <CId>c3</CId>
            <AId>a2</AId>
            <SId>s1</SId>
            <JId>j3</JId>
        </Audition>

        <Audition>
            <Score>4</Score>
            <CId>c4</CId>
            <AId>a4</AId>
            <SId>s1</SId>
            <JId>j1</JId>
        </Audition>
        <Audition>
            <Score>5</Score>
            <CId>c4</CId>
            <AId>a4</AId>
            <SId>s1</SId>
            <JId>j2</JId>
        </Audition>
        <Audition>
            <Score>6</Score>
            <CId>c4</CId>
            <AId>a4</AId>
            <SId>s1</SId>
            <JId>j3</JId>
        </Audition>

        <Audition>
            <Score>9</Score>
            <CId>c6</CId>
            <AId>a4</AId>
            <SId>s1</SId>
            <JId>j1</JId>
        </Audition>
        <Audition>
            <Score>9</Score>
            <CId>c6</CId>
            <AId>a4</AId>
            <SId>s1</SId>
            <JId>j2</JId>
        </Audition>
        <Audition>
            <Score>7</Score>
            <CId>c6</CId>
            <AId>a4</AId>
            <SId>s1</SId>
            <JId>j3</JId>
        </Audition>

        <Audition>
            <Score>7</Score>
            <CId>c6</CId>
            <AId>a5</AId>
            <SId>s1</SId>
            <JId>j1</JId>
        </Audition>
        <Audition>
            <Score>7</Score>
            <CId>c6</CId>
            <AId>a5</AId>
            <SId>s1</SId>
            <JId>j2</JId>
        </Audition>
        <Audition>
            <Score>10</Score>
            <CId>c6</CId>
            <AId>a5</AId>
            <SId>s1</SId>
            <JId>j3</JId>
        </Audition>



        <Audition>
            <Score>8</Score>
            <CId>c2</CId>
            <AId>a5</AId>
            <SId>s2</SId>
            <JId>j1</JId>
        </Audition>
        <Audition>
            <Score>6</Score>
            <CId>c2</CId>
            <AId>a5</AId>
            <SId>s2</SId>
            <JId>j4</JId>
        </Audition>

        <Audition>
            <Score>3</Score>
            <CId>c3</CId>
            <AId>a6</AId>
            <SId>s2</SId>
            <JId>j1</JId>
        </Audition>
        <Audition>
            <Score>5</Score>
            <CId>c3</CId>
            <AId>a6</AId>
            <SId>s2</SId>
            <JId>j4</JId>
        </Audition>

        <Audition>
            <Score>9</Score>
            <CId>c3</CId>
            <AId>a4</AId>
            <SId>s2</SId>
            <JId>j1</JId>
        </Audition>
        <Audition>
            <Score>10</Score>
            <CId>c3</CId>
            <AId>a4</AId>
            <SId>s2</SId>
            <JId>j4</JId>
        </Audition>

        <Audition>
            <Score>7</Score>
            <CId>c7</CId>
            <AId>a6</AId>
            <SId>s2</SId>
            <JId>j1</JId>
        </Audition>
        <Audition>
            <Score>6</Score>
            <CId>c7</CId>
            <AId>a6</AId>
            <SId>s2</SId>
            <JId>j4</JId>
        </Audition>

        <Audition>
            <Score>8</Score>
            <CId>c4</CId>
            <AId>a2</AId>
            <SId>s2</SId>
            <JId>j1</JId>
        </Audition>
        <Audition>
            <Score>7</Score>
            <CId>c4</CId>
            <AId>a2</AId>
            <SId>s2</SId>
            <JId>j4</JId>
        </Audition>

        <Audition>
            <Score>5</Score>
            <CId>c5</CId>
            <AId>a4</AId>
            <SId>s2</SId>
            <JId>j1</JId>
        </Audition>
        <Audition>
            <Score>5</Score>
            <CId>c5</CId>
            <AId>a4</AId>
            <SId>s2</SId>
            <JId>j4</JId>
        </Audition>

        <Audition>
            <Score>7</Score>
            <CId>c5</CId>
            <AId>a3</AId>
            <SId>s2</SId>
            <JId>j1</JId>
        </Audition>
        <Audition>
            <Score>6</Score>
            <CId>c5</CId>
            <AId>a3</AId>
            <SId>s2</SId>
            <JId>j4</JId>
        </Audition>



        <Audition>
            <Score>8</Score>
            <CId>c2</CId>
            <AId>a3</AId>
            <SId>s3</SId>
            <JId>j3</JId>
        </Audition>
        <Audition>
            <Score>7</Score>
            <CId>c2</CId>
            <AId>a3</AId>
            <SId>s3</SId>
            <JId>j4</JId>
        </Audition>
        <Audition>
            <Score>9</Score>
            <CId>c2</CId>
            <AId>a3</AId>
            <SId>s3</SId>
            <JId>j5</JId>
        </Audition>

        <Audition>
            <Score>7</Score>
            <CId>c7</CId>
            <AId>a4</AId>
            <SId>s3</SId>
            <JId>j3</JId>
        </Audition>
        <Audition>
            <Score>6</Score>
            <CId>c7</CId>
            <AId>a4</AId>
            <SId>s3</SId>
            <JId>j4</JId>
        </Audition>
        <Audition>
            <Score>4</Score>
            <CId>c7</CId>
            <AId>a4</AId>
            <SId>s3</SId>
            <JId>j5</JId>
        </Audition>

        <Audition>
            <Score>6</Score>
            <CId>c4</CId>
            <AId>a5</AId>
            <SId>s3</SId>
            <JId>j3</JId>
        </Audition>
        <Audition>
            <Score>8</Score>
            <CId>c4</CId>
            <AId>a5</AId>
            <SId>s3</SId>
            <JId>j4</JId>
        </Audition>
        <Audition>
            <Score>7</Score>
            <CId>c4</CId>
            <AId>a5</AId>
            <SId>s3</SId>
            <JId>j5</JId>
        </Audition>

        <Audition>
            <Score>9</Score>
            <CId>c5</CId>
            <AId>a1</AId>
            <SId>s3</SId>
            <JId>j3</JId>
        </Audition>
        <Audition>
            <Score>7</Score>
            <CId>c5</CId>
            <AId>a1</AId>
            <SId>s3</SId>